{
  "schema": "dispatcher-compshare-runtime-lock/v2",
  "capability": "matclaw-cips",
  "image_name": "mlff-matclaw-cips-gpu-v1",
  "note": "Frozen MatClaw CIPS GPU runtime for MLFFBench (Cases 031, 032, 033). Built from recipe base-env-build/matclaw-cips-gpu/recipe.lock.json.",
  "provider": "compshare",
  "artifact": {
    "kind": "compshare_image",
    "image_id": null,
    "image_source": "custom"
  },
  "provenance": {
    "base_image": "compshare/pytorch:2.1.2-cuda12.1-cudnn8-devel-ubuntu22.04",
    "recipe_digest": "sha256:2e2d41847edacdf78d94a8854699260ea72e895a9b26ed101700bc6319809bbc",
    "recipe_path": "base-env-build/matclaw-cips-gpu/recipe.lock.json",
    "cuda_version": "12.1",
    "software_versions": {
      "python": "3.11.15",
      "cuda": "12.1"
    }
  },
  "qualification": {
    "status": "UNBUILT",
    "receipt_path": null,
    "receipt_digest": null,
    "site_profile_id": null
  },
  "env": {
    "CUDA_VISIBLE_DEVICES": "0",
    "TF_FORCE_GPU_ALLOW_GROWTH": "true"
  }
}
