{
  "schema": "dispatcher-compshare-runtime-lock/v2",
  "capability": "matclaw-cips",
  "image_name": "mlff-matclaw-cips-gpu-v1",
  "note": "Frozen MatClaw CIPS GPU runtime for Bench (Cases 001, 002, 003). Built from recipe runtimes/recipes/matclaw-cips-gpu/recipe.lock.json.",
  "provider": "compshare",
  "artifact": {
    "kind": "compshare_image",
    "image_id": "compshareImage-1uw6sd44931i",
    "image_source": "custom"
  },
  "provenance": {
    "base_image": "compshare/pytorch:2.1.2-cuda12.1-cudnn8-devel-ubuntu22.04",
    "recipe_digest": "sha256:640e02b4aa6f3c50395b583e0c51166a02d83015128eb929d81b08f07bd5fbe5",
    "recipe_path": "runtimes/recipes/matclaw-cips-gpu/recipe.lock.json",
    "cuda_version": "12.1",
    "software_versions": {
      "python": "3.11.15",
      "cuda": "12.1"
    }
  },
  "qualification": {
    "status": "BUILT_NOT_QUALIFIED",
    "receipt_path": "matclaw-cips/receipt.json",
    "receipt_digest": "sha256:1f15385d714565561701272bbc5333b1c2e3cb9fa7441de6d8ea4bfe90648f05",
    "site_profile_id": "compshare-gpu-production"
  },
  "env": {
    "CUDA_VISIBLE_DEVICES": "0",
    "TF_FORCE_GPU_ALLOW_GROWTH": "true"
  }
}
